企業名	コード	事業の内容	主要な設備の状況	役員の状況
リンク	4428	"３【事業の内容】　当社は「われわれは在庫に関わる""人""、""もの""、""金""、""時間""、""情報""を最適化するITソリューションを提供し、限りある資源を有効活用することで、広く社会に貢献する。」を基本理念とし、在庫を抱える流通業の発展と活性化に貢献するサービスを提供する事業運営を行っております。その実現のために「世界中の無駄を10%削減する」をビジョンに掲げ、小売業・卸売業・製造業の流通三層の在庫を最適化するためのソフトウェアパッケージ群「sinops（シノプス）シリーズ」を展開しております。 ■「sinopsシリーズ」の事業領域 　なお、当社の事業は「sinops事業」の単一セグメントであり、①「sinopsシリーズ」を一括販売型で提供するパッケージ販売、②「sinopsシリーズ」を利用料型で提供するレンタル販売、③「sinops」の導入効果を最大化するためのシステム構築及び運用構築を支援する導入支援サービス、④「sinops」の日常運用を支援するサポートサービスの４つのサービスを軸に事業を展開しております。また、当社には、エンドユーザーに対する直接販売及び販売パートナーによる販売の２種類の販売形態があります。  (1）パッケージ販売　当社のパッケージ販売は、小売業向け需要予測型自動発注システム「sinops-R6」を中心に、品揃え計画・棚割計画・棚割メンテナンス・発注端末・本部送り込み支援・賞味期限管理等の機能が統合されたソフトウェアパッケージ群を一括販売型で提供しております。また、卸売業向けキャッシュ・フロー最適化システム「sinops-W」、製造業向け中長期需要予測システム「sinops-M」といったように、流通三層それぞれに適したパッケージ製品を展開しております。当社のパッケージ販売の特徴は、他社事例を参考にした費用対効果の提示ではなく、顧客の実データを利用したシミュレーション結果に基づきsinops導入の費用対効果を具体的な金額で提示することにあります。 ■需要予測型自動発注システム「sinops-R6」　「sinops-R6」はエキスパート法によるAI機能（※１）を搭載した小売業向け需要予測型自動発注システムです。特に牛乳・卵・豆腐・袋麺などの日配食品や、惣菜、パンなど、賞味期限が短く、かつ、週に何度かのチラシ特売により価格も頻繁に変わるカテゴリへの自動発注における実績が多くあります。例えば、ある牛乳を50円引きで特売すると何割販売数が増えるのかの予測はもちろん、代わりに日頃最もよく売れている牛乳がその影響を受け何割販売数が減るのかというカニバリゼーション（共食い状態）を正確に予測する必要があります。カニバリゼーションを考慮しなければ、商品の賞味期限が複数の日付になる前に、余った商品に値引きシールを貼って販売せざるをえなくなり、その作業の無駄と値引きによる損失が発生してしまいます。さらに悪化し、廃棄するとその損失は収益に大きな影響を与えることになります。　「sinops-R6」は過去のデータから商品ごとに販売価格別に数量PI（1,000人あたりの販売数）を自動計算するのみならず、影響を受けるライバル商品の数量PIも合わせて計算し必要に応じて発注数を抑制しますので、欠品による機会ロスのみならず、値引きロスや廃棄ロスをも合わせて改善することができます。     ■店舗での発注業務をタブレット１つで完結「sinops-Pad/GOT」　「sinops-Pad」は、iPad/Windowsタブレット上で棚割（※２）を修正できるシステムであり、従来の棚割システムでは非常に面倒だった棚割修正をタブレット上で直感的に操作できるシステムです。その結果、棚割データが現場と一致しやすくなり、最適発注を継続するための重要な要素である棚割情報を正確に把握できるようになります。　また、「sinops-GOT」はiPad/Windowsタブレットを発注端末として利用できるシステムであり、「sinops-Pad」とセットで利用することで店舗の発注関連業務をワンストップで解決できます。  「sinops-Pad画面」「sinops-GOT画面」  ■「sinopsシリーズ」について対象製品名概要内容提供価値小売業sinops-R（※３）自動発注システムグロサリ（※４）だけでなく、日配食品・パン・惣菜にまで対応した自動発注システム。AI機能を搭載し、従来は人が考えて設定していたパラメータを自動設定できるようになっております。・自動化による人手不足解消・ロス削減による利益向上・欠品削減による売上向上・在庫削減による　キャッシュ・フロー改善sinops-Pad棚割メンテナンスアプリiPad/Windowsタブレット上で棚割を修正でき、従来の棚割システムでは非常に面倒だった棚割修正をタブレット上で直感的に操作できるシステム。その結果、現場の棚割情報が本部でも正確に把握できるようになります。・棚割修正作業の効率化・店舗の棚割情報を本部でも　正確に把握sinops-GOT発注端末アプリiPad/Windowsタブレットを発注端末として利用できるシステムであり、「sinops-Pad」とセットで利用することで店舗の発注関連業務をワンストップで解決できます。・発注作業の効率化sinops-DM本部送り込み支援システム本部送り込み（※５）を支援し、企画商品をどの店舗にいくつ配荷したら特売残が最小になるかを自動算出するシステム。・特売残（※６）の削減sinops-MD品揃最適化システム店舗ごとの販売実績から最適な品揃え・最適陳列数を提案するシステム。sinops-Rと連携することで、収益を最大化する品揃え計画の立案が可能になります。・個店採算性の向上sinops-Dcont賞味期限チェックアプリ賞味期限チェック作業を効率化するシステム。・賞味期限チェック作業の削減・賞味期限切れ販売の削減卸売業sinops-Wキャッシュ・フロー最適化システム毎日需要予測を行い、発注点を自動更新することで最適在庫を維持し続ける自動発注システム。仕入条件・賞味期限・商品受け入れ作業時間といった様々なことを考慮し、キャッシュ・フローを最適化できます。・在庫削減による　キャッシュ・フロー改善・自動化による人手不足解消・欠品削減による売上向上sinops-IM移送指示最適化システムsinops-Wと連携することで過剰在庫を算出し、拠点間の在庫偏在を解消するように移送指示を行うシステム。在庫の有無を拠点間で確認する必要がなくなり、自動で出てくる移送指示を承認するだけで作業が完了します。・在庫削減による　キャッシュ・フロー改善・無駄な発注の削減製造業sinops-M中長期需要予測システムエリア別の製品需要を予測し、製造業の生産計画の精度向上に貢献するシステム。シリーズのsinops-R/Wと連携することでデマンド・チェーン・マネジメント（※７）を確立でき、大幅な在庫削減を実現します。・在庫削減による　キャッシュ・フロー改善 (2）レンタル販売　レンタル販売は、パッケージ販売の一括販売型と異なり、利用料型で提供しております。顧客にとっては、ライセンス費用やサーバ費用といった初期導入コストを抑えられることがメリットとなります。 (3）導入支援サービス　導入支援サービスは、「sinopsシリーズ」を導入する企業に対して、基幹システムとのデータ連携、本部・店舗・拠点での運用構築支援及びインターフェイスなどのカスタマイズ開発のサービスを提供しております。当社の導入支援サービスの特徴としては、ただシステムを連携するのではなく、導入企業が「sinops」の導入効果を高めるための支援を行うことにあります。また、パッケージ販売もしくはレンタル販売した企業には、必ず導入支援サービスを提供し、導入企業が「sinopsシリーズ」の導入効果を出すことを最重要視しております。 (4）サポートサービス　サポートサービスは、「sinopsシリーズ」の導入支援サービスが完了した企業に対して、日々の問い合わせ対応、稼働・運用状況の監視、障害発生時のリカバリ作業及びKPIの維持・向上サービスを提供しております。  ■用語の説明※１　エキスパート法によるAI機能　エキスパート法とは、専門知識のない素人あるいは初心者でも専門家と同じレベルの問題解決が可能となるよう、その領域の専門知識をもとに動作するコンピュータシステムのことです。システムは専門家のかわりに特定の分野に特化した知識をもとに推論を行い、専門家のようにアドバイスや診断を行います。 ※２　棚割　棚割とは、商品を陳列棚のどこに、いくつ陳列するかを計画することをいいます。 ※３　sinops-R　「sinops-R」は「sinops-Rシリーズ」の総称で、旧バージョンである「sinops-R4」「sinops-R5」及び最新バージョンである「sinops-R6」を含んでおります。 ※４　グロサリ　グロサリとは、一般的に冷蔵を要しない食品や雑貨を指します。例えば、調味料、飲料、お菓子や缶詰があげられます。 ※５　本部送り込み　本部送り込みとは、小売業において、本部のバイヤーが企画・仕入れた商品を本部主導で各店舗へ送り込むことをいいます。 ※６　特売残　特売残とは、企画商品や本部送り込み商品の売れ残りのことです。 ※７　デマンド・チェーン・マネジメント　需要側（消費者等）から得られる情報を基点として商品開発、生産・供給計画、流通、販売体制等を統合的に編成する情報管理システムのことです。具体的には、POSデータ等の情報をもとに需要予測を行い、生産管理や在庫管理を最適化することを目指すシステムです。 ■事業系統図 "	２【主要な設備の状況】当社は、国内に２ヶ所の営業所及び事務所を有しております。以上のうち、主要な設備は、以下のとおりであります。2018年12月31日現在 事業所名(所在地)設備の内容帳簿価額従業員数(人)建物（千円）工具、器具及び備品（千円）合計（千円）本社(大阪府大阪市北区)事務所設備5,9004,20210,10255東京営業所(東京都千代田区)事務所設備2,984-2,9845　（注）１．上記の金額には消費税等を含めておりません。２．本社、東京営業所の建物は賃借であり、年間賃借料はそれぞれ以下のとおりであります。本社　　　　　　31,562千円東京営業所　　　 9,841千円３．当社は「sinops事業」の単一セグメントであるため、セグメント別の記載を省略しております。 	５【役員の状況】男性　８名　女性　―名　（役員のうち女性の比率　―％）役名職名氏名生年月日略歴任期所有株式数（株）代表取締役―南谷　洋志1954年10月24日1978年４月　大都商事株式会社（現ダイトロン株式会社）入社1982年１月　須磨電子産業株式会社入社1987年10月　当社設立、代表取締役（現任）2017年12月　合同会社南谷ホールディングス設立、代表社員（現任）(注)４442,000(注)5常務取締役営業部長林　亨1972年７月20日1995年４月　株式会社イシダ入社2001年４月　山陽イシダ株式会社兵庫営業所所長2004年５月　同　取締役営業部長2011年５月　四国イシダ株式会社取締役営業部長2012年５月　同　代表取締役2016年７月　当社常務取締役営業部長（現任）(注)４-取締役技術部長岡本　数彦1974年５月25日1997年４月　株式会社アーティフィッシャル・インテリジェンス入社2001年10月　エイ・アイサービス株式会社入社2004年４月　当社入社2012年７月　同　執行役員営業部長2016年７月　同　執行役員ソリューション部長2018年１月　同　執行役員製品改善部長2019年１月　同　執行役員技術部長2019年３月　同　取締役技術部長（現任）(注)４1,000取締役管理部長島井　幸太郎1984年３月29日2008年４月　株式会社インテリジェンス入社2010年１月　当社入社2016年12月　同　執行役員管理部長2019年３月　同　取締役管理部長（現任）(注)４2,000取締役―角田　吉隆1955年４月17日1978年４月　バロース株式会社入社1981年11月　ユニー株式会社入社2007年５月　同　執行役員2017年６月　アトムス開業（現任）2018年３月　当社取締役（現任）(注)４-取締役（監査等委員）―畠山　隆雄1955年７月21日1986年10月　トーマツコンサルティング　　　　　　株式会社入社2000年６月　監査法人トーマツ（現有限責任監査法人トーマツ）入所2001年６月　人財活性化研究所開業2013年４月　関西学院大学専門職大学院経営戦略研究科教授（現任）2015年８月　当社入社、管理部嘱託2016年７月　当社監査役2018年３月　当社取締役（監査等委員）（現任）(注)６-取締役（監査等委員）―木村　安壽1949年４月３日1973年11月　等松青木監査法人（現有限責任監査法人トーマツ）入所1977年９月　公認会計士登録（現任）1991年７月　トーマツコンサルティング株式会社　代表取締役社長1995年７月　監査法人トーマツ代表社員1999年９月　木村公認会計士事務所開業（現任）2005年４月　関西学院大学専門職大学院経営戦略研究所会計専門職専攻教授2009年10月　当社監査役2018年３月　当社取締役（監査等委員）（現任）(注)６2,500 役名職名氏名生年月日略歴任期所有株式数（株）取締役（監査等委員）―南山　学1958年12月５日1981年４月　株式会社ワールド入社2001年６月　同　取締役2010年４月　株式会社メガスポーツ代表取締役社長2016年12月　株式会社チアフルプランニング代表取締役社長（現任）2018年３月　当社取締役（監査等委員）（現任）(注)６-計447,500　（注）１．2018年３月28日開催の定時株主総会において定款の変更が決議されたことにより、当社は同日付をもって監査等委員会設置会社に移行しております。２．取締役 角田吉隆、取締役（監査等委員）木村安壽及び南山学は、社外取締役であります。３．当社の監査等委員会については次のとおりであります。委員長 畠山隆雄、委員 木村安壽、委員 南山学なお、畠山隆雄は常勤の監査等委員であります。常勤の監査等委員を選定している理由は、社内事情に精通した者が、取締役会以外の重要な会議等への出席や、内部監査部門等との連携を密に図ることにより得られた情報をもとに、監査等委員会による監査の実効性を高めるためであります。４．取締役 南谷洋志、林亨、岡本数彦、島井幸太郎及び角田吉隆の任期は、2019年３月27日開催の定時株主総会終結の時から１年以内に終了する事業年度のうち最終のものに関する定時株主総会の終結の時までであります。５．取締役 南谷洋志の所有株式に、同人により総株主等の議決権の過半数を所有されている会社の所有株式数を合計しております。６．取締役（監査等委員）畠山隆雄、木村安壽及び南山学の任期は、2018年３月28日開催の定時株主総会終結の時から２年以内に終了する事業年度のうち最終のものに関する定時株主総会の終結の時までであります。７．各役員の所有する当社の株式数は、2019年２月28日時点の状況を記載しております。８．当社は、法令に定める監査等委員である取締役の員数を欠くことになる場合に備え、会社法第329条第３項に定める補欠取締役２名を選任しております。補欠取締役の略歴は次のとおりであります。 氏名生年月日略歴所有株式数（株）菅　智生1965年10月26日1989年４月　株式会社住友銀行(現株式会社三井住友銀行)入行2013年９月　プレミアインターナショナル株式会社財務・経理部長兼支配人2015年４月　大分県津久見市役所地域おこし特別職2016年10月　当社内部監査室長(現任)2018年３月　当社補欠監査等委員(現任)2,000島﨑　智久1967年１月20日1990年４月　トーマツコンサルティング株式会社入社1994年11月　シー・ウィングコンサルティング株式会社入社1998年５月　島﨑社会保険労務士事務所開業同代表(現任)2001年７月　株式会社ディレクタイズ取締役(現任)2008年２月　米国公認会計士(現任)2018年３月　当社補欠監査等委員(現任)－計2,000  
レオス・キャピタルワークス	7330			
